{
  "id": "char-akira",
  "name": "Akira",
  "class": "Rogue",
  "lvl": 4,
  "stats": {
    "STR": 10,
    "DEX": 16,
    "CON": 12,
    "INT": 11,
    "WIS": 13,
    "CHA": 9
  },
  "hp": {
    "max": 31,
    "current": 24
  },
  "inventory": [
    "lockpicks",
    "cloak"
  ],
  "tags": [
    "party"
  ],
  "notes": "Avoids frontline."
}